title,paperId,authors,year,venue,cited_survey_titles,cited_survey_count,abstract,citationCount,Calculation,includeFoundational
Agent Foundations for Aligning Machine Intelligence with Human Interests: A Technical Research Agenda,88fbf0a6ab0ce2329e3c9aca0d6f80cf405e207a,"[{'authorId': '1719968', 'name': 'N. Soares'}, {'authorId': '3442559', 'name': 'Benya Fallenstein'}]",2017,,"['AGI Safety Literature Review', 'AI safety: state of the field through quantitative lens']",2,,46.0,92,checked
AI Research Considerations for Human Existential Safety (ARCHES),a9c46dfd9a24c754a67386e02424ad68b1f4ab3b,"[{'authorId': '2651789', 'name': 'Andrew Critch'}, {'authorId': '145055042', 'name': 'David Krueger'}]",2020,arXiv.org,"['Unsolved Problems in ML Safety', 'AI Research Considerations for Human Existential Safety (ARCHES)']",2,"Framed in positive terms, this report examines how technical AI research might be steered in a manner that is more attentive to humanity's long-term prospects for survival as a species. In negative terms, we ask what existential risks humanity might face from AI development in the next century, and by what principles contemporary technical research might be directed to address those risks. 
A key property of hypothetical AI technologies is introduced, called \emph{prepotence}, which is useful for delineating a variety of potential existential risks from artificial intelligence, even as AI paradigms might shift. A set of \auxref{dirtot} contemporary research \directions are then examined for their potential benefit to existential safety. Each research direction is explained with a scenario-driven motivation, and examples of existing work from which to build. The research directions present their own risks and benefits to society that could occur at various scales of impact, and in particular are not guaranteed to benefit existential safety if major developments in them are deployed without adequate forethought and oversight. As such, each direction is accompanied by a consideration of potentially negative side effects.",21.0,42,checked
Vingean Reflection : Reliable Reasoning for Self-Improving Agents,77c7bbe446564bd3253bf720e4729a113b01b798,"[{'authorId': '1825635', 'name': 'Benja Fallenstein'}, {'authorId': '1719968', 'name': 'N. Soares'}]",2015,,"['AGI Safety Literature Review', 'AI Research Considerations for Human Existential Safety (ARCHES)']",2,"Today, human-level machine intelligence is in the domain of futurism, but there is every reason to expect that it will be developed eventually. Once artificial agents become able to improve themselves further, they may far surpass human intelligence, making it vitally important to ensure that the result of an “intelligence explosion” is aligned with human interests. In this paper, we discuss one aspect of this challenge: ensuring that the initial agent’s reasoning about its future versions is reliable, even if these future versions are far more intelligent than the current reasoner. We refer to reasoning of this sort as Vingean reflection. A self-improving agent must reason about the behavior of its smarter successors in abstract terms, since if it could predict their actions in detail, it would already be as smart as them. This is called the Vingean principle, and we argue that theoretical work on Vingean reflection should focus on formal models that reflect this principle. However, the framework of expected utility maximization, commonly used to model rational agents, fails to do so. We review a body of work which instead investigates agents that use formal proofs to reason about their successors. While it is unlikely that real-world agents would base their behavior entirely on formal proofs, this appears to be the best currently available formal model of abstract reasoning, and work in this setting may lead to insights applicable to more realistic approaches to Vingean",17.0,34,checked
Human Compatible: Artificial Intelligence and the Problem of Control,6df2126301ab415aed034b0bcd9589b1897fe983,"[{'authorId': '2055581632', 'externalIds': {'DBLP': ['Stuart Russell']}, 'url': 'https://www.semanticscholar.org/author/2055581632', 'name': 'Stuart Russell', 'aliases': None, 'affiliations': [], 'homepage': None, 'paperCount': 7, 'citationCount': 453, 'hIndex': 4}]",2019,,['Human Compatible: Artificial Intelligence and the Problem of Control'],1,"""The most important book I have read in quite some time"" (Daniel Kahneman); ""A must-read"" (Max Tegmark); ""The book we've all been waiting for"" (Sam Harris) LONGLISTED FOR THE 2019 FINANCIAL TIMES AND MCKINSEY BUSINESS BOOK OF THE YEAR; A FINANCIAL TIMES BEST BOOK OF THE YEAR 2019 Humans dream of super-intelligent machines. But what happens if we actually succeed? Creating superior intelligence would be the biggest event in human history. Unfortunately, according to the world's pre-eminent AI expert, it could also be the last. In this groundbreaking book on the biggest question facing humanity, Stuart Russell explains why he has come to consider his own discipline an existential threat to our species, and lays out how we can change course before it's too late. There is no one better placed to assess the promise and perils of the dominant technology of the future than Russell, who has spent decades at the forefront of AI research. Through brilliant analogies and crisp, lucid prose, he explains how AI actually works, how it has an enormous capacity to improve our lives - but why we must ensure that we never lose control of machines more powerful than we are. Here Russell shows how we can avert the worst threats by reshaping the foundations of AI to guarantee that machines pursue our objectives, not theirs. Profound, urgent and visionary, Human Compatible is the one book everyone needs to read to understand a future that is coming sooner than we think.",326.0,326,checked
Life 3.0: Being Human in the Age of Artificial Intelligence,64fda6dc4dfe08f515439c4f255c9766c7487880,"[{'authorId': '2011933', 'externalIds': {'DBLP': ['Max Tegmark']}, 'url': 'https://www.semanticscholar.org/author/2011933', 'name': 'Max Tegmark', 'aliases': ['M Tegmark', 'M. Tegmark'], 'affiliations': [], 'homepage': None, 'paperCount': 274, 'citationCount': 28979, 'hIndex': 79}]",2017,,['Life 3.0: Being Human in the Age of Artificial Intelligence'],1,"New York Times Best Seller How will Artificial Intelligence affect crime, war, justice, jobs, society and our very sense of being human? The rise of AI has the potential to transform our future more than any other technologyand theres nobody better qualified or situated to explore that future than Max Tegmark, an MIT professor whos helped mainstream research on how to keep AI beneficial. How can we grow our prosperity through automation without leaving people lacking income or purpose? What career advice should we give todays kids? How can we make future AI systems more robust, so that they do what we want without crashing, malfunctioning or getting hacked? Should we fear an arms race in lethal autonomous weapons? Will machines eventually outsmart us at all tasks, replacing humans on the job market and perhaps altogether? Will AI help life flourish like never before or give us more power than we can handle? What sort of future do you want? This book empowers you to join what may be the most important conversation of our time. It doesnt shy away from the full range of viewpoints or from the most controversial issuesfrom superintelligence to meaning, consciousness and the ultimate physical limits on life in the cosmos.",173.0,173,checked
X-Risk Analysis for AI Research,3ba793e937cb90ea3e82b4a6903ee4a95f307ddf,"[{'authorId': '3422872', 'externalIds': {'DBLP': ['Dan Hendrycks']}, 'url': 'https://www.semanticscholar.org/author/3422872', 'name': 'Dan Hendrycks', 'aliases': None, 'affiliations': ['UC Berkeley'], 'homepage': 'danhendrycks.com', 'paperCount': 49, 'citationCount': 11806, 'hIndex': 28}, {'authorId': '16787428', 'externalIds': {'DBLP': ['Mantas Mazeika']}, 'url': 'https://www.semanticscholar.org/author/16787428', 'name': 'Mantas Mazeika', 'aliases': ['Mantas Mažeika'], 'affiliations': [], 'homepage': None, 'paperCount': 18, 'citationCount': 2928, 'hIndex': 12}]",2022,arXiv.org,['X-Risk Analysis for AI Research'],1,"Artificial intelligence (AI) has the potential to greatly improve society, but as with any powerful technology, it comes with heightened risks and responsibilities. Current AI research lacks a systematic discussion of how to manage long-tail risks from AI systems, including speculative long-term risks. Keeping in mind the potential benefits of AI, there is some concern that building ever more intelligent and powerful AI systems could eventually result in systems that are more powerful than us; some say this is like playing with fire and speculate that this could create existential risks (x-risks). To add precision and ground these discussions, we provide a guide for how to analyze AI x-risk, which consists of three parts: First, we review how systems can be made safer today, drawing on time-tested concepts from hazard analysis and systems safety that have been designed to steer large processes in safer directions. Next, we discuss strategies for having long-term impacts on the safety of future systems. Finally, we discuss a crucial concept in making AI systems safer by improving the balance between safety and general capabilities. We hope this document and the presented concepts and tools serve as a useful guide for understanding how to analyze AI x-risk.",17.0,17,checked
AI safety: state of the field through quantitative lens,2e5ab5250e524801e2efd24249d75fcbb80f2b99,"[{'authorId': '2066411673', 'externalIds': {}, 'url': 'https://www.semanticscholar.org/author/2066411673', 'name': 'Mislav Juric', 'aliases': None, 'affiliations': [], 'homepage': None, 'paperCount': 2, 'citationCount': 14, 'hIndex': 1}, {'authorId': '2064105646', 'externalIds': {}, 'url': 'https://www.semanticscholar.org/author/2064105646', 'name': 'A. Sandic', 'aliases': ['A. Sandic', 'Agneza Sandic'], 'affiliations': [], 'homepage': None, 'paperCount': 2, 'citationCount': 15, 'hIndex': 1}, {'authorId': '35167635', 'externalIds': {'DBLP': ['Mario Brcic']}, 'url': 'https://www.semanticscholar.org/author/35167635', 'name': 'Mario Brčič', 'aliases': ['Mario Brcic', 'Mario Brčić'], 'affiliations': [], 'homepage': None, 'paperCount': 45, 'citationCount': 667, 'hIndex': 7}]",2020,"International Convention on Information and Communication Technology, Electronics and Microelectronics",['AI safety: state of the field through quantitative lens'],1,"Last decade has seen major improvements in the performance of artificial intelligence which has driven wide-spread applications. Unforeseen effects of such massad-option has put the notion of AI safety into the public eye. AI safety is a relatively new field of research focused on techniques for building AI beneficial for humans. While there exist survey papers for the field of AI safety, there is a lack of a quantitative look at the research being conducted. The quantitative aspect gives a data-driven insight about the emerging trends, knowledge gaps and potential areas for future research. In this paper, bibliometric analysis of the literature finds significant increase in research activity since 2015. Also, the field is so new that most of the technical issues are open, including: explainability and its long-term utility, and value alignment which we have identified as the most important long-term research topic. Equally, there is a severe lack of research into concrete policies regarding AI. As we expect AI to be the one of the main driving forces of changes, AI safety is the field under which we need to decide the direction of humanity’s future.",14.0,14,checked