title,paperId,authors,year,venue,cited_survey_titles,cited_survey_count,abstract,citationCount,Calculation,includeFoundational
The Vulnerable World Hypothesis,41918a9ed66135691d741d0285c5ef24ea9597ff,"[{'authorId': '2193691', 'name': 'N. Bostrom'}]",2019,Global Policy,"['Unsolved Problems in ML Safety', 'AI Research Considerations for Human Existential Safety (ARCHES)', 'X-Risk Analysis for AI Research']",3,"Scientific and technological progress might change people’s capabilities or incentives in ways that would destabilize civilization. For example, advances in DIY biohacking tools might make it easy for anybody with basic training in biology to kill millions; novel military technologies could trigger arms races in which whoever strikes first has a decisive advantage; or some economically advantageous process may be invented that produces disastrous negative global externalities that are hard to regulate. This paper introduces the concept of a vulnerable world: roughly, one in which there is some level of technological development at which civilization almost certainly gets devastated by default, i.e. unless it has exited the ‘semi-anarchic default condition’. Several counterfactual historical and speculative future vulnerabilities are analyzed and arranged into a typology. A general ability to stabilize a vulnerable world would require greatly amplified capacities for preventive policing and global governance. The vulnerable world hypothesis thus offers a new perspective from which to evaluate the risk-benefit balance of developments towards ubiquitous surveillance or a unipolar world order. Policy Implications • Technology policy should not unquestioningly assume that all technological progress is beneficial, or that complete scientific openness is always best, or that the world has the capacity to manage any potential downside of a technology after it is invented. • Some areas, such as synthetic biology, could produce a discovery that suddenly democratizes mass destruction, e.g. by empowering individuals to kill hundreds of millions of people using readily available materials. In order for civilization to have a general capacity to deal with “black ball” inventions of this type, it would need a system of ubiquitous real-time worldwide surveillance. In some scenarios, such a system would need to be in place before the technology is invented. • Partial protection against a limited set of possible black balls is obtainable through more targeted interventions. For example, biorisk might be mitigated by means of background checks and monitoring of personnel in some types of biolab, by discouraging DIY biohacking (e.g. through licencing requirements), and by restructuring the biotech sector to limit access to some cutting-edge instrumentation and information. Rather than allow anybody to buy their own DNA synthesis machine, DNA synthesis could be provided as a service by a small number of closely monitored providers. • Another, subtler, type of black ball would be one that strengthens incentives for harmful use—e.g. a military technology that makes wars more destructive while giving a greater advantage to the side that strikes first. Like a squirrel who uses the times of plenty to store up nuts for the winter, we should use times of relative peace to build stronger mechanisms for resolving international disputes. Is there a black ball in the urn of possible inventions? One way of looking at human creativity is as a process of pulling balls out of a giant urn. The balls represent possible ideas, discoveries, technological inventions. Over the course of history, we have extracted a great many balls – mostly white (beneficial) but also various shades of gray (moderately harmful ones and mixed blessings). The cumulative effect on the human condition has so far been overwhelmingly positive, and may be much better still in the future (Bostrom, 2008). The global population has grown about three orders of magnitude over the last ten thousand years, and in the last two centuries per capita income, standards of living, and life expectancy have also risen. What we haven’t extracted, so far, is a black ball: a technology that invariably or by default destroys the civilization that invents it. The reason is not that we have been particularly careful or wise in our technology policy. We have just been lucky. It does not appear that any human civilization has been destroyed – as opposed to transformed – by its own inventions. We do have examples of civilizations being destroyed by inventions made elsewhere. For example, the European inventions that enabled transoceanic travel and force projection could be regarded as a black-ball event for the indigenous populations of the Americas, Australia, Tasmania, and some other places. The extinction of archaic hominid populations, such as the Neanderthals and the Denisovans, was probably facilitated by the technological superiority of Homo sapiens. But thus far, it seems, we have seen no sufficiently auto-destructive invention to count as a black ball for humanity. What if there is a black ball in the urn? If scientific and technological research continues, we will eventually reach it and pull it out. Our civilization has a considerable ability to Global Policy (2019) 10:4 doi: 10.1111/1758-5899.12718 © 2019 The Authors. Global Policy published by Durham University and John Wiley & Sons Ltd. This is an open access article under the terms of the Creative Commons Attribution-NonCommercial License, which permits use, distribution and reproduction in any medium, provided the original work is properly cited and is not used for commercial purposes. Global Policy Volume 10 . Issue 4 . November 2019 455",80.0,240,checked
AI safety via debate,5a5a1d666e4b7b933bc5aafbbadf179bc447ee67,"[{'authorId': '2060655766', 'name': 'G. Irving'}, {'authorId': '145791315', 'name': 'P. Christiano'}, {'authorId': '2698777', 'name': 'Dario Amodei'}]",2018,arXiv.org,"['AGI Safety Literature Review', 'Unsolved Problems in ML Safety', 'AI safety: state of the field through quantitative lens']",3,"To make AI systems broadly useful for challenging real-world tasks, we need them to learn complex human goals and preferences. One approach to specifying complex goals asks humans to judge during training which agent behaviors are safe and useful, but this approach can fail if the task is too complicated for a human to directly judge. To help address this concern, we propose training agents via self play on a zero sum debate game. Given a question or proposed action, two agents take turns making short statements up to a limit, then a human judges which of the agents gave the most true, useful information. In an analogy to complexity theory, debate with optimal play can answer any question in PSPACE given polynomial time judges (direct judging answers only NP questions). In practice, whether debate works involves empirical questions about humans and the tasks we want AIs to perform, plus theoretical questions about the meaning of AI alignment. We report results on an initial MNIST experiment where agents compete to convince a sparse classifier, boosting the classifier's accuracy from 59.4% to 88.9% given 6 pixels and from 48.2% to 85.2% given 4 pixels. Finally, we discuss theoretical and practical aspects of the debate model, focusing on potential weaknesses as the model scales up, and we propose future human and computer experiments to test these properties.",72.0,216,checked
Risks from Learned Optimization in Advanced Machine Learning Systems,7ee12d3bf8e0ce20d281b4550e39a1ee53839452,"[{'authorId': '146614650', 'name': 'Evan Hubinger'}, {'authorId': '146400709', 'name': 'Chris van Merwijk'}, {'authorId': '148305440', 'name': 'Vladimir Mikulik'}, {'authorId': '147156275', 'name': 'Joar Skalse'}, {'authorId': '1740494', 'name': 'Scott Garrabrant'}]",2019,arXiv.org,"['Unsolved Problems in ML Safety', 'AI safety: state of the field through quantitative lens', 'X-Risk Analysis for AI Research']",3,"We analyze the type of learned optimization that occurs when a learned model (such as a neural network) is itself an optimizer - a situation we refer to as mesa-optimization, a neologism we introduce in this paper. We believe that the possibility of mesa-optimization raises two important questions for the safety and transparency of advanced machine learning systems. First, under what circumstances will learned models be optimizers, including when they should not be? Second, when a learned model is an optimizer, what will its objective be - how will it differ from the loss function it was trained under - and how can it be aligned? In this paper, we provide an in-depth analysis of these two primary questions and provide an overview of topics for future research.",48.0,144,checked
Omohundro ’ s “ Basic AI Drives ” and Catastrophic Risks,738db99fd925069c988f9bd1df52446309d5e9c4,"[{'authorId': '3389522', 'name': 'Carl Shulman'}]",2013,,"['AI Research Considerations for Human Existential Safety (ARCHES)', 'Responses to catastrophic AGI risk: a survey', 'Superintelligence: Paths, Dangers, Strategies']",3,"Shulman, Carl. 2010. Omohundro's "" Basic AI Drives "" and Catastrophic Risks.",19.0,57,checked
The Superintelligent Will: Motivation and Instrumental Rationality in Advanced Artificial Agents,6c25aae58187f716d1b6db34200bbf3b63007aeb,"[{'authorId': '2193691', 'name': 'N. Bostrom'}]",2012,Minds and Machines,"['AI Research Considerations for Human Existential Safety (ARCHES)', 'Responses to catastrophic AGI risk: a survey', 'Superintelligence: Paths, Dangers, Strategies']",3,,13.0,39,checked
"Superintelligence: Paths, Dangers, Strategies",e0fe9b2f77288bc5e6f778611a49e62e98231f8c,"[{'authorId': '145155783', 'name': 'C. Robert'}]",2017,,"['AGI Safety Literature Review', 'AI Research Considerations for Human Existential Safety (ARCHES)']",2,,707.0,1414,checked
"Artificial Intelligence (AI): Multidisciplinary perspectives on emerging challenges, opportunities, and agenda for research, practice and policy",6a132499ca1dc0d23cfe7d5db841b819df63b51b,"[{'authorId': '1724490', 'name': 'Yogesh Kumar Dwivedi'}, {'authorId': '2066599148', 'name': 'Laurie Hughes'}, {'authorId': '3446873', 'name': 'Elvira Ismagilova'}, {'authorId': '91018104', 'name': 'G. Aarts'}, {'authorId': '2235927', 'name': 'C. Coombs'}, {'authorId': '2285182', 'name': 'Tom Crick'}, {'authorId': '144521858', 'name': 'Y. Duan'}, {'authorId': '1410968693', 'name': 'R. Dwivedi'}, {'authorId': '143698898', 'name': 'J. Edwards'}, {'authorId': '121714298', 'name': 'Aled Eirug'}, {'authorId': '26898704', 'name': 'Vassilis Galanos'}, {'authorId': '2937059', 'name': 'P. V. Ilavarasan'}, {'authorId': '50817520', 'name': 'M. Janssen'}, {'authorId': '2168272578', 'name': 'Paul Jones'}, {'authorId': '2733956', 'name': 'A. Kar'}, {'authorId': '41074539', 'name': 'Hatice Kizgin'}, {'authorId': '1418648774', 'name': 'Bianca Kronemann'}, {'authorId': '1696747', 'name': 'Banita Lal'}, {'authorId': '3094343', 'name': 'B. Lucini'}, {'authorId': '2575165', 'name': 'R. Medaglia'}, {'authorId': '1404797274', 'name': 'K. L. Meunier-FitzHugh'}, {'authorId': '1415234363', 'name': 'L. L. Meunier-FitzHugh'}, {'authorId': '47033159', 'name': 'S. Misra'}, {'authorId': '52563419', 'name': 'Emmanuel Mogaji'}, {'authorId': '2038468629', 'name': 'S. Sharma'}, {'authorId': '153278840', 'name': 'Jang B. Singh'}, {'authorId': '35098701', 'name': 'Vishnupriya Raghavan'}, {'authorId': '2775338', 'name': 'R. Raman'}, {'authorId': '1688149', 'name': 'N. Rana'}, {'authorId': '2032434', 'name': 'Spyridon Samothrakis'}, {'authorId': '66781543', 'name': 'Jak Spencer'}, {'authorId': '2191954', 'name': 'K. Tamilmani'}, {'authorId': '102927759', 'name': 'Annie Tubadji'}, {'authorId': '144340154', 'name': 'P. Walton'}, {'authorId': '2116399602', 'name': 'Michael D. Williams'}]",2019,International Journal of Information Management,"['AI safety: state of the field through quantitative lens', 'Artificial Intelligence (AI): Multidisciplinary perspectives on emerging challenges, opportunities, and agenda for research, practice and policy']",2,,670.0,1340,checked
Global Catastrophic Risks,7a530509b53bf0374d7d04bb99ba4ea831e33ebc,"[{'authorId': '2193691', 'name': 'N. Bostrom'}, {'authorId': '2547770', 'name': 'M. Ćirković'}]",2008,,"['Responses to catastrophic AGI risk: a survey', 'X-Risk Analysis for AI Research']",2,"Acknowledgements Foreword Introduction I BACKGROUND Long-term astrophysical processes Evolution theory and the future of humanity Millenial tendencies in responses to apocalyptic threats Cognitive biases potentially affecting judgement of global risks Observation selection effects and global catastrophic risks Systems-based risk analysis Catastrophes and insurance Public policy towards catastrophe II RISKS FROM NATURE Super-volcanism and other geophysical processes of catastrophic import Hazards from comets and asteroids Influence of Supernovae, gamma-ray bursts, solar flares, and cosmic rays on the terrestrial environment III RISKS FROM UNINTENDED CONSEQUENCES Climate change and global risk Plagues and pandemics: past, present, and future Artificial Intelligence as a positive and negative factor in global risk Big troubles, imagined and real IV RISKS FROM HOSTILE ACTS Catastrophe, social collapse, and and human extinction The continuing threat of nuclear war Catastrophic nuclear terrorism: a preventable peril Biotechnology and biosecurity Nanotechnology as global catastrophic risk The totalitarian threat Author's biographies Index",346.0,692,checked
Existential Risk Prevention as Global Priority,ced289065723368bca48636edf71eeed50f40a39,"[{'authorId': '2193691', 'name': 'N. Bostrom'}]",2013,,"['AGI Safety Literature Review', 'AI Research Considerations for Human Existential Safety (ARCHES)']",2,"risks are those that threaten the entire future of humanity. Many theories of value imply that even relatively small reductions in net existential risk have enormous expected value. Despite their importance, issues surrounding human-extinction risks and related hazards remain poorly understood. In this article, I clarify the concept of existential risk and develop an improved classification scheme. I discuss the relation between existential risks and basic issues in axiology, and show how existential risk reduction (via the maxipok rule) can serve as a strongly action-guiding principle for utilitarian concerns. I also show how the notion of existential risk suggests a new way of thinking about the ideal of sustainability. Policy Implications • Existential risk is a concept that can focus long-term global efforts and sustainability concerns. • The biggest existential risks are anthropogenic and related to potential future technologies. • A moral case can be made that existential risk reduction is strictly more important than any other global public good. • Sustainability should be reconceptualised in dynamic terms, as aiming for a sustainable trajectory rather than a sus- tainable state. • Some small existential risks can be mitigated today directly (e.g. asteroids) or indirectly (by building resilience and reserves to increase survivability in a range of extreme scenarios) but it is more important to build capacity to improve humanity's ability to deal with the larger existential risks that will arise later in this century. This will require collective wisdom, technology foresight, and the ability when necessary to mobilise a strong global coordi- nated response to anticipated existential risks. • Perhaps the most cost-effective way to reduce existential risks today is to fund analysis of a wide range of existen- tial risks and potential mitigation strategies, with a long-term perspective.",323.0,646,checked
Thinking Inside the Box: Controlling and Using an Oracle AI,6d78d67d4f7f5fe2e66933778ab1faf119d21547,"[{'authorId': '2054678912', 'name': 'S. Armstrong'}, {'authorId': '144816231', 'name': 'A. Sandberg'}, {'authorId': '2193691', 'name': 'N. Bostrom'}]",2012,Minds and Machines,"['AGI Safety Literature Review', 'Responses to catastrophic AGI risk: a survey']",2,,105.0,210,checked
Aligning AI With Shared Human Values,65906e6027246ae9e4ecd18d6e019a24505c842e,"[{'authorId': '3422872', 'name': 'Dan Hendrycks'}, {'authorId': '90909974', 'name': 'Collin Burns'}, {'authorId': '104444594', 'name': 'Steven Basart'}, {'authorId': '2651789', 'name': 'Andrew Critch'}, {'authorId': '46276596', 'name': 'J. Li'}, {'authorId': '143711382', 'name': 'D. Song'}, {'authorId': '5164568', 'name': 'J. Steinhardt'}]",2020,International Conference on Learning Representations,"['Unsolved Problems in ML Safety', 'X-Risk Analysis for AI Research']",2,"We show how to assess a language model's knowledge of basic concepts of morality. We introduce the ETHICS dataset, a new benchmark that spans concepts in justice, well-being, duties, virtues, and commonsense morality. Models predict widespread moral judgments about diverse text scenarios. This requires connecting physical and social world knowledge to value judgements, a capability that may enable us to steer chatbot outputs or eventually regularize open-ended reinforcement learning agents. With the ETHICS dataset, we find that current language models have a promising but incomplete understanding of basic ethical knowledge. Our work shows that progress can be made on machine ethics today, and it provides a steppingstone toward AI that is aligned with human values.",97.0,194,checked
Unsolved Problems in ML Safety,05c2e1ee203be217f100d2da05bdcc52004f00b6,"[{'authorId': '3422872', 'externalIds': {'DBLP': ['Dan Hendrycks']}, 'url': 'https://www.semanticscholar.org/author/3422872', 'name': 'Dan Hendrycks', 'aliases': None, 'affiliations': ['UC Berkeley'], 'homepage': 'danhendrycks.com', 'paperCount': 49, 'citationCount': 11806, 'hIndex': 28}, {'authorId': '2483738', 'externalIds': {'DBLP': ['Nicholas Carlini']}, 'url': 'https://www.semanticscholar.org/author/2483738', 'name': 'Nicholas Carlini', 'aliases': None, 'affiliations': [], 'homepage': None, 'paperCount': 101, 'citationCount': 22448, 'hIndex': 40}, {'authorId': '47971768', 'externalIds': {'DBLP': ['John D. Schulman', 'John Schulman']}, 'url': 'https://www.semanticscholar.org/author/47971768', 'name': 'J. Schulman', 'aliases': ['J Schulman', 'John D. Schulman', 'John Schulman'], 'affiliations': [], 'homepage': None, 'paperCount': 68, 'citationCount': 38493, 'hIndex': 41}, {'authorId': '5164568', 'externalIds': {'DBLP': ['Jacob Steinhardt']}, 'url': 'https://www.semanticscholar.org/author/5164568', 'name': 'J. Steinhardt', 'aliases': ['J. Steinhardt', 'Jacob Steinhardt'], 'affiliations': [], 'homepage': None, 'paperCount': 98, 'citationCount': 7795, 'hIndex': 33}]",2021,arXiv.org,"['Unsolved Problems in ML Safety', 'X-Risk Analysis for AI Research']",2,"Machine learning (ML) systems are rapidly increasing in size, are acquiring new capabilities, and are increasingly deployed in high-stakes settings. As with other powerful technologies, safety for ML should be a leading research priority. In response to emerging safety challenges in ML, such as those introduced by recent large-scale models, we provide a new roadmap for ML Safety and refine the technical problems that the field needs to address. We present four problems ready for research, namely withstanding hazards (""Robustness""), identifying hazards (""Monitoring""), reducing inherent model hazards (""Alignment""), and reducing systemic hazards (""Systemic Safety""). Throughout, we clarify each problem's motivation and provide concrete research directions.",88.0,176,checked
AGI Safety Literature Review,6b0b1ecca32809b1d5b70b978521a8c27bc98e25,"[{'authorId': '1868196', 'externalIds': {'DBLP': ['Tom Everitt'], 'ORCID': '0000-0003-1210-9866'}, 'url': 'https://www.semanticscholar.org/author/1868196', 'name': 'Tom Everitt', 'aliases': None, 'affiliations': ['DeepMind'], 'homepage': 'http://tomeveritt.se', 'paperCount': 40, 'citationCount': 955, 'hIndex': 14}, {'authorId': '1954561', 'externalIds': {'DBLP': ['Gary Lea']}, 'url': 'https://www.semanticscholar.org/author/1954561', 'name': 'G. Lea', 'aliases': ['G. Lea', 'Gary R Lea', 'Gary R. Lea', 'Gary Lea'], 'affiliations': [], 'homepage': None, 'paperCount': 15, 'citationCount': 168, 'hIndex': 4}, {'authorId': '144154444', 'externalIds': {'DBLP': ['Marcus Hutter'], 'ORCID': '0000-0002-3263-4097'}, 'url': 'https://www.semanticscholar.org/author/144154444', 'name': 'Marcus Hutter', 'aliases': ['M. Hutter'], 'affiliations': [], 'homepage': 'http://www.hutter1.net/', 'paperCount': 300, 'citationCount': 7548, 'hIndex': 39}]",2018,International Joint Conference on Artificial Intelligence,"['AGI Safety Literature Review', 'AI safety: state of the field through quantitative lens']",2,"The development of Artificial General Intelligence (AGI) promises to be a major event. Along with its many potential benefits, it also raises serious safety concerns. The intention of this paper is to provide an easily accessible and up-to-date collection of references for the emerging field of AGI safety. A significant number of safety problems for AGI have been identified. We list these, and survey recent research on solving them. We also cover works on how best to think of AGI from the limited knowledge we have today, predictions for when AGI will first be created, and what will happen after its creation. Finally, we review the current public policy on AGI.",79.0,158,checked
Aligning Superintelligence with Human Interests: A Technical Research Agenda,d8033a314493c8df3791912272ac4b58d3a7b8c2,"[{'authorId': '1719968', 'name': 'N. Soares'}, {'authorId': '1825635', 'name': 'Benja Fallenstein'}]",2015,,"['AGI Safety Literature Review', 'AI Research Considerations for Human Existential Safety (ARCHES)']",2,"The property that has given humans a dominant advantage over other species is not strength or speed, but intelligence. If progress in artificial intelligence continues unabated, AI systems will eventually exceed humans in general reasoning ability. A system that is “superintelligent” in the sense of being “smarter than the best human brains in practically every field” could have an enormous impact upon humanity (Bostrom 2014). Just as human intelligence has allowed us to develop tools and strategies for controlling our environment, a superintelligent system would likely be capable of developing its own tools and strategies for exerting control (Muehlhauser and Salamon 2012). In light of this potential, it is essential to use caution when developing AI systems that can exceed human levels of general intelligence, or that can facilitate the creation of such systems.",77.0,154,checked
"Delusion, Survival, and Intelligent Agents",d8a200f7e0ef5659d544b4f5306251deaf781d1b,"[{'authorId': '11023955', 'name': 'Mark B. Ring'}, {'authorId': '1749270', 'name': 'Laurent Orseau'}]",2011,Artificial General Intelligence,"['AGI Safety Literature Review', 'Responses to catastrophic AGI risk: a survey']",2,,76.0,152,checked
Safety Engineering for Artificial General Intelligence,2b1f2b906c23444e38e95d40779377db6ac51bb6,"[{'authorId': '1976753', 'name': 'Roman V Yampolskiy'}, {'authorId': '49824819', 'name': 'Joshua Fox'}]",2012,,"['AI safety: state of the field through quantitative lens', 'Responses to catastrophic AGI risk: a survey']",2,,68.0,136,checked
Intelligence Explosion: Evidence and Import,40e3086dd279fd23042b37962d8e67f5fd9801ae,"[{'authorId': '2138143', 'name': 'Luke Muehlhauser'}, {'authorId': '144958976', 'name': 'A. Salamon'}]",2012,,"['Responses to catastrophic AGI risk: a survey', 'Superintelligence: Paths, Dangers, Strategies']",2,,66.0,132,checked
The Nature of Self-Improving Artificial Intelligence,4618cbdfd7dada7f61b706e4397d4e5952b5c9a0,"[{'authorId': '1808760', 'name': 'S. Omohundro'}]",2008,,"['AGI Safety Literature Review', 'Responses to catastrophic AGI risk: a survey']",2,"An electronic still camera indicates the available capacity of a recording medium and the number of frames remaining that may be photographed, as well as warning by stages in at least two forms, based on the available capacity of the recording medium. The electronic still camera includes a photo lens, mirror, CCD, signal executing circuit, A/D converter, buffer memory, compression circuit, CPU, memory card, and indicator device. A CPU reads in the gross capacity and the written-on portion from a memory card and calculates the available capacity. When the available capacity becomes small, the indicator device that indicates the available capacity or the number of frames remaining that can be photographed begins to flash the display slowly on and off. When the available capacity grows even smaller and is almost gone, the display flashes rapidly on and off. In this way, the photographer can easily detect how many more frames he or she may photograph on the memory card.",59.0,118,checked
How long until human-level AI? Results from an expert assessment,17863bc49f8337b1646ad203ab12d716b8e90e48,"[{'authorId': '2097800', 'name': 'S. Baum'}, {'authorId': '1738080', 'name': 'B. Goertzel'}, {'authorId': '49961666', 'name': 'T. Goertzel'}]",2011,,"['AGI Safety Literature Review', 'Responses to catastrophic AGI risk: a survey']",2,,54.0,108,checked
The Singularity and Machine Ethics,63cd604886aa453ce626626d97959e378ccdc788,"[{'authorId': '2138143', 'name': 'Luke Muehlhauser'}, {'authorId': '102699296', 'name': 'Louie Helm'}]",2012,,"['Responses to catastrophic AGI risk: a survey', 'Superintelligence: Paths, Dangers, Strategies']",2,,49.0,98,checked
